{
  "schema_version": "secret-0002-witness-realization-0.1",
  "realization_id": "wrlz.signing.20260424.001",
  "bridge_trace": "trace.signing.20260412.001",
  "challenge": {
    "challenge_id": "challenge.sigreq.signing.20260414.001",
    "challenge_kind": "signer-operation",
    "domain": "signing-key",
    "requested_action": {
      "kind": "sign",
      "ref": "sigreq.signing.20260414.001"
    }
  },
  "state_read": {
    "materialization_session_ref": "session.req.signing.20260412.001",
    "signature_request_ref": "sigreq.signing.20260414.001",
    "signature_response_ref": "sigresp.signing.20260414.001",
    "session_state": "issued",
    "bridge_decision_effect": "accept",
    "authority_refs": [
      "binding.release-signing-key",
      "backend.hsm-rooted-signing",
      "materializer.unix-socket-proxy"
    ]
  },
  "action_selection": {
    "selected_action": "sign",
    "basis": "session-state",
    "reason": "issued signing-key session allows the non-exportable sign-proxy operation"
  },
  "witness_plan": {
    "plan_id": "wplan.signing.20260424.001",
    "artifact_kind": "signature-response",
    "validator_profile_id": "validator.signer-broker.secret-0002"
  },
  "witness_artifact": {
    "artifact_kind": "signature-response",
    "artifact_ref": "examples/generated.signature-response.signing-key.allow.json",
    "artifact_digest": {
      "alg": "sha256",
      "value": "257afa4db75a95ffb4b4cac45c5a5f3a7d712a134dcd22c70793e3c306294338"
    }
  },
  "validator_profile": {
    "profile_id": "validator.signer-broker.secret-0002",
    "profile_kind": "signer-broker",
    "law_refs": [
      "SIGNER-SESSION-CONTRACT.md",
      "WITNESS-REALIZATION-CONTRACT.md"
    ]
  },
  "validation_result": {
    "result_id": "vresult.signing.20260424.001",
    "verdict": "accepted"
  },
  "state_transition": {
    "transition_id": "transition.signing.20260424.001",
    "from_state": "issued",
    "to_state": "issued",
    "receipt_ref": "audit://trace.signing.20260412.001/signature/sigreq.signing.20260414.001",
    "next_session_epoch": 11
  }
}
